{
  "schema_version": 1,
  "project": "A股量化交易系统 V1.3",
  "plan_version": "1.0",
  "updated_at": "2026-10-18T08:07:13.712493+00:00",
  "baseline": "f1382c10f2c3d356be6e059aad5611d15d687a62",
  "weight_basis": "首版任务规划：治理10%、数据25%、市场/选股20%、风险10%、回测20%、日报10%、最终5%；十阶段细分和任务点数是可审查的规划参数，不是工时或生产收益实测。历史诊断零权重，实际工时未知保留 null；不是生产就绪率。调整需独立计划修订，保留事件/evidence/Git 历史。",
  "stages": [
    {
      "id": "S1",
      "name": "Git 基线和开发工作区治理",
      "weight": 4,
      "depends_on": [],
      "deliverables": "TASK-016 分支与 worktree 审计；TASK-017 干净 main 与统一工作区",
      "exit_condition": "成功远端核实/干净跟踪 main，所有原修改受保护"
    },
    {
      "id": "S2",
      "name": "任务看板与开发流程治理",
      "weight": 6,
      "depends_on": [
        "S1"
      ],
      "deliverables": "TASK-GOV-001 模型路由治理；TASK-018 正式任务看板与进度机制",
      "exit_condition": "权重/证据/状态/重算/UI 一致且独立治理审查通过"
    },
    {
      "id": "S3",
      "name": "行情工作台和数据源健康检查",
      "weight": 8,
      "depends_on": [
        "S1",
        "S2"
      ],
      "deliverables": "TASK-003 AKShare 历史日线适配；TASK-009 腾讯候选源与 Demo 集成；TASK-015 健康检查与调度入口",
      "exit_condition": "两源边界、健康预算和 UI 审查通过；真实可用性另有证据"
    },
    {
      "id": "S4",
      "name": "历史行情、证券主数据与交易日历质量",
      "weight": 17,
      "depends_on": [
        "S3"
      ],
      "deliverables": "TASK-002 SQLite 数据基础设施；TASK-004 证券主数据与日历最小存储；TASK-004A 真实主数据与日历验收；TASK-PLAN-DATA-QUALITY 历史行情/实体/日历/复权质量验收",
      "exit_condition": "真实主数据/日历/历史行情/复权/许可与可得时间可靠且缺口明确"
    },
    {
      "id": "S5",
      "name": "全 A 市场宽度与市场过滤",
      "weight": 8,
      "depends_on": [
        "S4"
      ],
      "deliverables": "TASK-PLAN-BREADTH 全 A 市场宽度与过滤",
      "exit_condition": "已验收历史证券池上的全市场覆盖、过滤与缺失门禁通过"
    },
    {
      "id": "S6",
      "name": "选股策略与评分",
      "weight": 12,
      "depends_on": [
        "S4",
        "S5"
      ],
      "deliverables": "TASK-PLAN-SELECTION 版本化选股规则与评分",
      "exit_condition": "评分口径/历史输入/排序解释与样本外规则冻结"
    },
    {
      "id": "S7",
      "name": "风险管理与交易执行约束",
      "weight": 10,
      "depends_on": [
        "S4",
        "S6"
      ],
      "deliverables": "TASK-PLAN-RISK 风控与交易执行约束",
      "exit_condition": "停牌/涨跌停/可交易性/仓位/费用滑点及现金持仓约束通过"
    },
    {
      "id": "S8",
      "name": "历史回测与无未来函数审查",
      "weight": 20,
      "depends_on": [
        "S4",
        "S6",
        "S7"
      ],
      "deliverables": "TASK-PLAN-BACKTEST 历史回测执行与样本外测试；TASK-PLAN-BACKTEST-REVIEW 独立回测正确性与无未来函数验收",
      "exit_condition": "执行/记账/成本可复现，前置与事后独立未来函数审查及样本外测试通过"
    },
    {
      "id": "S9",
      "name": "每日报告与自动化运行",
      "weight": 10,
      "depends_on": [
        "S8"
      ],
      "deliverables": "TASK-PLAN-REPORT 每日报告与静态产物；TASK-PLAN-AUTOMATION 人工批准的本地自动化运行",
      "exit_condition": "日报 schema/无敏感静态发布边界/人工批准调度及失败告警通过"
    },
    {
      "id": "S10",
      "name": "V1.3 端到端验收",
      "weight": 5,
      "depends_on": [
        "S9"
      ],
      "deliverables": "TASK-PLAN-END-TO-END V1.3 全链路与生产准入",
      "exit_condition": "冻结版本和数据快照的端到端验收及人工生产准入批准；不自动接交易账户"
    }
  ],
  "tasks": [
    {
      "id": "TASK-001",
      "title": "七份架构与契约文档",
      "type": "implementation",
      "priority": "P0",
      "stage": "S2",
      "weight": 0,
      "origin": "EXECUTED",
      "assigned_model": "gpt-6.1-sol",
      "assigned_effort": "high",
      "model_assignment": "PROPOSED_FOR_CONTINUATION",
      "actual_model": null,
      "actual_effort": null,
      "model_basis": "历史实际型号无可靠记录；指定值仅为续执行/未来唯一建议，不追溯声称已由它执行",
      "cost_class": "H",
      "estimated_hours": null,
      "goal": "七份架构与契约文档；仅限所列验收范围",
      "depends_on": [],
      "acceptance": [
        {
          "id": "docs",
          "label": "架构/数据/接口/决策/验收/计划/审计文档存在",
          "weight": 100,
          "mandatory": true,
          "evidence_kinds": [
            "report"
          ]
        }
      ],
      "recommendation_rank": 100,
      "recommendation_reason": "前置验收满足后再按此工作包推进；未满足时不推荐"
    },
    {
      "id": "TASK-GOV-001",
      "title": "模型路由治理",
      "type": "implementation",
      "priority": "P0",
      "stage": "S2",
      "weight": 40,
      "origin": "EXECUTED",
      "assigned_model": "gpt-6.1-sol",
      "assigned_effort": "high",
      "model_assignment": "CONFIRMED",
      "actual_model": "gpt-6.1-sol",
      "actual_effort": "high",
      "model_basis": "实际模型来自实施记录/本会话确认",
      "cost_class": "H",
      "estimated_hours": null,
      "goal": "模型路由治理；仅限所列验收范围",
      "depends_on": [],
      "acceptance": [
        {
          "id": "rules",
          "label": "规则与路由制度已落库",
          "weight": 40,
          "mandatory": true,
          "evidence_kinds": [
            "report"
          ]
        },
        {
          "id": "template",
          "label": "模板与开始纪律",
          "weight": 20,
          "mandatory": true,
          "evidence_kinds": [
            "report"
          ]
        },
        {
          "id": "review",
          "label": "独立治理审查",
          "weight": 30,
          "mandatory": true,
          "evidence_kinds": [
            "review"
          ]
        },
        {
          "id": "merge",
          "label": "治理 PR 合并",
          "weight": 10,
          "mandatory": true,
          "evidence_kinds": [
            "pr"
          ]
        }
      ],
      "recommendation_rank": 100,
      "recommendation_reason": "前置验收满足后再按此工作包推进；未满足时不推荐"
    },
    {
      "id": "TASK-016",
      "title": "分支与 worktree 审计",
      "type": "implementation",
      "priority": "P0",
      "stage": "S1",
      "weight": 40,
      "origin": "EXECUTED",
      "assigned_model": "gpt-6.1-sol",
      "assigned_effort": "high",
      "model_assignment": "CONFIRMED",
      "actual_model": "gpt-6.1-sol",
      "actual_effort": "high",
      "model_basis": "实际模型来自实施记录/本会话确认",
      "cost_class": "H",
      "estimated_hours": null,
      "goal": "分支与 worktree 审计；仅限所列验收范围",
      "depends_on": [],
      "acceptance": [
        {
          "id": "audit",
          "label": "审计与逐文件证据交付",
          "weight": 50,
          "mandatory": true,
          "evidence_kinds": [
            "report"
          ]
        },
        {
          "id": "preserve",
          "label": "原现场保护",
          "weight": 30,
          "mandatory": true,
          "evidence_kinds": [
            "report"
          ]
        },
        {
          "id": "merge",
          "label": "报告合并",
          "weight": 20,
          "mandatory": true,
          "evidence_kinds": [
            "pr"
          ]
        }
      ],
      "recommendation_rank": 100,
      "recommendation_reason": "前置验收满足后再按此工作包推进；未满足时不推荐"
    },
    {
      "id": "TASK-017",
      "title": "干净 main 与统一工作区",
      "type": "implementation",
      "priority": "P0",
      "stage": "S1",
      "weight": 60,
      "origin": "EXECUTED",
      "assigned_model": "gpt-6.1-sol",
      "assigned_effort": "high",
      "model_assignment": "CONFIRMED",
      "actual_model": "gpt-6.1-sol",
      "actual_effort": "high",
      "model_basis": "实际模型来自实施记录/本会话确认",
      "cost_class": "H",
      "estimated_hours": null,
      "goal": "干净 main 与统一工作区；仅限所列验收范围",
      "depends_on": [
        {
          "task": "TASK-016",
          "acceptance": [
            "audit"
          ]
        }
      ],
      "acceptance": [
        {
          "id": "baseline",
          "label": "成功 ls-remote/fetch 核实",
          "weight": 40,
          "mandatory": true,
          "evidence_kinds": [
            "report"
          ]
        },
        {
          "id": "isolation",
          "label": "干净 main/upstream/隔离",
          "weight": 30,
          "mandatory": true,
          "evidence_kinds": [
            "report"
          ]
        },
        {
          "id": "preserve",
          "label": "原现场保护",
          "weight": 20,
          "mandatory": true,
          "evidence_kinds": [
            "report"
          ]
        },
        {
          "id": "report",
          "label": "报告交付",
          "weight": 10,
          "mandatory": true,
          "evidence_kinds": [
            "report"
          ]
        }
      ],
      "recommendation_rank": 100,
      "recommendation_reason": "前置验收满足后再按此工作包推进；未满足时不推荐"
    },
    {
      "id": "TASK-018",
      "title": "正式任务看板与进度机制",
      "type": "implementation",
      "priority": "P0",
      "stage": "S2",
      "weight": 60,
      "origin": "REQUESTED",
      "assigned_model": "gpt-6.1-sol",
      "assigned_effort": "high",
      "model_assignment": "CONFIRMED",
      "actual_model": "gpt-6.1-sol",
      "actual_effort": "high",
      "model_basis": "实际模型来自实施记录/本会话确认",
      "cost_class": "H",
      "estimated_hours": {
        "low": 6,
        "high": 12,
        "basis": "首版未经工时实测校准的工作量范围，非历史实际工时"
      },
      "goal": "正式任务看板与进度机制；仅限所列验收范围",
      "depends_on": [
        {
          "task": "TASK-017",
          "acceptance": [
            "baseline",
            "isolation"
          ]
        },
        {
          "task": "TASK-GOV-001",
          "acceptance": [
            "rules"
          ]
        }
      ],
      "acceptance": [
        {
          "id": "data",
          "label": "结构化权重/文档一致",
          "weight": 25,
          "mandatory": true,
          "evidence_kinds": [
            "code"
          ]
        },
        {
          "id": "engine",
          "label": "重算/历史/依赖/候选反馈",
          "weight": 25,
          "mandatory": true,
          "evidence_kinds": [
            "code"
          ]
        },
        {
          "id": "offline",
          "label": "完整离线回归与隔离",
          "weight": 15,
          "mandatory": true,
          "evidence_kinds": [
            "offline"
          ]
        },
        {
          "id": "ui",
          "label": "真实浏览器离线进度页",
          "weight": 15,
          "mandatory": true,
          "evidence_kinds": [
            "ui"
          ]
        },
        {
          "id": "review",
          "label": "独立审查最终 SHA",
          "weight": 15,
          "mandatory": true,
          "evidence_kinds": [
            "review"
          ]
        },
        {